{
  "schema_version": "1.1",
  "exception_id": "exc_preprod_temp_egress_001",
  "project_id": "proj_customer_support_ai",
  "scope": {
    "environment": "preprod",
    "components": [
      "api-service"
    ],
    "controls": [
      "network.outbound_allowlist"
    ]
  },
  "requested_by": "user:devlead",
  "rationale": "Temporary external sandbox endpoint needed for vendor validation in preprod only.",
  "compensating_controls": [
    "time-bound allowlist",
    "enhanced audit logging",
    "daily review"
  ],
  "approved_by": [
    "user:secmgr"
  ],
  "status": "active",
  "start_at": "2026-02-21T10:30:00-06:00",
  "expires_at": "2026-03-07T10:30:00-06:00",
  "review_cadence_days": 3,
  "trace_id": "trc_exc_001"
}
